{
  "schemaVersion": 1,
  "id": "sample",
  "title": "Tarea de ejemplo",
  "status": "draft",
  "branch": "task/sample",
  "worktree": null,
  "correctionCycle": 0,
  "dispatch": {
    "approved": false,
    "approvedBy": null,
    "approvedAt": null
  },
  "implementation": {
    "completed": false,
    "commit": null
  },
  "audit": {
    "decision": "pending",
    "auditedBy": null,
    "auditedAt": null
  },
  "merge": {
    "approved": false,
    "approvedBy": null,
    "approvedAt": null,
    "commit": null
  },
  "timestamps": {
    "createdAt": "2026-09-23T14:39:40.760757+00:00",
    "updatedAt": "2026-09-23T14:39:40.760757+00:00"
  }
}
